"Story","Title","Result","Date","Stability","Duration (s)"
"To test the forgot password functionality","To validate the forgot password functionality with valid and invalid credentials.","FAILURE","2023-08-29T13:52:23.7861761+05:30[Asia/Calcutta]","0.0","169.14"
"To verify the need help functionality","To test the need help functionality","SUCCESS","2023-08-29T14:25:37.7197937+05:30[Asia/Calcutta]","0.0","38.49"
"To test the Afrexim Bank server","To verify the login functionality","SUCCESS","2023-08-29T14:26:16.2256842+05:30[Asia/Calcutta]","0.0","32.31"
"To validate the Signup functionality of Afrexim page","To validate the signup functionality","FAILURE","2023-08-29T14:26:48.5632515+05:30[Asia/Calcutta]","0.0","77.04"
"To validate the Functionality of Investers Option in Afrexim Bank","To Test the Investers dropdown","ERROR","2023-08-29T14:28:05.6282411+05:30[Asia/Calcutta]","0.0","1.74"
"To validate the Functionality of Investers Option in Afrexim Bank","To Test the Investers_FinancialInformation Functionality","FAILURE","2023-08-29T14:28:07.4643231+05:30[Asia/Calcutta]","0.0","53.58"
"To validate the Functionality of Investers Option in Afrexim Bank","To Test the Investers Option in Afrexim Bank","SUCCESS","2023-08-29T14:29:01.3000969+05:30[Asia/Calcutta]","0.0","40.9"
